{"apiVersion":"argus.dev/performance-mapping-policy/v1","repository":{"provider":"github","host":"github.com","providerRepositoryId":"R_orders_01"},"headRevision":{"algorithm":"git-sha1","digest":"89abcdef0123456789abcdef0123456789abcdef"},"impactSha256":"f556f30c772d10d847db7baf79008eae84dd47c45ff4720985c8bf9a28dd29c6","catalogSha256":"d07fc9198cd088b4dfa1b783c2bab2f33c1770ed6d5617fa626a9ab80c20ec19","reviewId":"review-1","reviewedBy":"owner","reviewedAt":"2026-10-22T11:30:00Z","expiresAt":"2026-10-22T12:30:00Z","headCapabilities":["create-order"],"allowedProfiles":[{"issuer":"https://provider.example/identity","id":"checkout-smoke","revision":"1","sha256":"aaaaaaaaaaaaaaaaaaaaaaaaaaaaaaaaaaaaaaaaaaaaaaaaaaaaaaaaaaaaaaaa"}],"deployments":[{"environment":{"issuer":"https://provider.example/identity","id":"staging","revision":"1","sha256":"aaaaaaaaaaaaaaaaaaaaaaaaaaaaaaaaaaaaaaaaaaaaaaaaaaaaaaaaaaaaaaaa"},"reference":{"issuer":"https://provider.example/identity","id":"candidate-deployment","revision":"1","sha256":"aaaaaaaaaaaaaaaaaaaaaaaaaaaaaaaaaaaaaaaaaaaaaaaaaaaaaaaaaaaaaaaa"},"service":{"issuer":"https://services.example","id":"checkout"},"imageSha256":"dddddddddddddddddddddddddddddddddddddddddddddddddddddddddddddddd","sourceRevision":{"algorithm":"git-sha1","digest":"89abcdef0123456789abcdef0123456789abcdef"}}],"mappings":[{"id":"orders-smoke","capability":"create-order","workload":{"issuer":"https://provider.example/identity","id":"checkout","revision":"1","sha256":"aaaaaaaaaaaaaaaaaaaaaaaaaaaaaaaaaaaaaaaaaaaaaaaaaaaaaaaaaaaaaaaa"},"profile":{"issuer":"https://provider.example/identity","id":"checkout-smoke","revision":"1","sha256":"aaaaaaaaaaaaaaaaaaaaaaaaaaaaaaaaaaaaaaaaaaaaaaaaaaaaaaaaaaaaaaaa"},"environment":{"issuer":"https://provider.example/identity","id":"staging","revision":"1","sha256":"aaaaaaaaaaaaaaaaaaaaaaaaaaaaaaaaaaaaaaaaaaaaaaaaaaaaaaaaaaaaaaaa"},"policy":{"issuer":"https://provider.example/identity","id":"checkout-policy","revision":"1","sha256":"aaaaaaaaaaaaaaaaaaaaaaaaaaaaaaaaaaaaaaaaaaaaaaaaaaaaaaaaaaaaaaaa"},"baseline":{"issuer":"https://provider.example/identity","id":"approved-baseline","revision":"1","sha256":"aaaaaaaaaaaaaaaaaaaaaaaaaaaaaaaaaaaaaaaaaaaaaaaaaaaaaaaaaaaaaaaa"}}]}